{
  "status": "da_kiem_chung",
  "verified_on": "dia_12, 2026-10-30",
  "profile": "dia",
  "subjects": [
    "dia"
  ],
  "section_levels": [
    {
      "prefix": "## ",
      "regex": "^([IVX]+)\\. ",
      "example": "## I. VỊ TRÍ ĐỊA LÍ, PHẠM VI LÃNH THỔ"
    },
    {
      "prefix": "### ",
      "regex": "^(\\d+)\\. ",
      "example": "### 1. Vị trí địa lí"
    },
    {
      "prefix": "**",
      "regex": "^([a-z])\\) ",
      "example": "**a) Thế mạnh**"
    }
  ],
  "formula": "none",
  "audit_focus": [
    "mo_ta",
    "hinh"
  ],
  "conventions": [
    "Địa danh nước ngoài và tên khoáng sản phiên âm giữ dấu gạch nối như sách in ở Tầng 1 (Cam-pu-chia, Ma-lai-xi-a, Xi-bia, bô-xít, a-pa-tít, các-xtơ); ở Tầng 2 có thể kèm nguyên ngữ theo Bảng phiên âm cuối sách.",
    "Chữ viết tắt trên bản đồ và trong bài giữ nguyên theo quy ước của sách: BĐ. (Bán đảo), QĐ. (Quần đảo), S. (Sông), TP. (Thành phố), GDP, GRDP, FDI, ASEAN, WTO, EU, UNESCO.",
    "Đơn vị đo lường giữ nguyên cách viết trong sách: km², °C, mm, ha, hải lí, ‰."
  ],
  "open_questions": []
}
